{
  "name": "RedHatProfile",
  "desc": "A profile that detects RedHat.",
  "meta": {
    "uuid": "1b7bbd69-fc43-4bc0-81ae-24f35d218bb0",
    "relations": {
      "INSTANCE_OF": {
        "direction": "outgoing",
        "to": ["Profile"]
      },
      "APPLIES_TO": {
        "direction": "outgoing",
        "to": ["RedHat"]
      },
      "PROVIDED_BY": {
        "direction": "outgoing",
        "to": ["RedHat"]
      }
    }
  },
  "data": {
    "commands": {
      "uname": {
        "command": "cat /etc/redhat-release",
        "matches": "Red Hat Enterprise Linux"
      }
    }
  }
}
