{
  "name": "CentOS",
  "desc": "The CentOS operating system.",
  "meta": {
    "uuid": "10d6c52d-b3aa-4cf8-89f2-1046bff622d8",
    "relations": {
      "ISA": {
        "direction": "outgoing",
        "to": ["Linux"]
      }
    }
  },
  "file": {
    "dataSchema": {
      "encoding": "text",
      "format": "json",
      "path": "../schemas/centos.schema.json"
    }
  }
}
