  {
    "name": "Service",
    "desc": "A generic local/networked/daemonized service.",
    "meta": {
      "uuid": "3fb4603b-281e-47c0-b338-768ea05d4660",
      "relations": {
        "ISA": {
          "direction": "outgoing",
          "to": [
            "8db2b492-9a4a-41fe-97a5-bc625da042ea"
          ]
        }
      },
      "constraints": {
        "HAS": [
          {
            "cardinality": "OPTIONAL_TO_MANY",
            "to": "91c999a0-33ec-42ee-bae0-6f8adae42535"
          }
        ]
      }
    },
    "file": {
      "dataSchema": {
        "encoding": "text",
        "format": "json",
        "path": "../schema/service.schema.json"
      }
    }
  }
