{
    "name": "SambaClient",
    "desc": "The Same *nix smb client.",
    "meta": {
        "uuid": "f513ddfc-e50b-49b4-9bd8-64afc61ff7a5",
        "relations": {
            "ISA": {
                "direction": "outgoing",
                "to": [
                    "7d1c7242-2403-4578-b6c4-789573ea3c45"
                ]
            },
            "IMPLEMENTS": {
                "direction": "outgoing",
                "to": [
                    "0771de77-c3d8-4db1-92fa-7ac96205f9bb"
                ]
            }
        }
    },
    "file": {
        "dataSchema": {
            "encoding": "text",
            "format": "json",
            "path": "../schema/sambaclient.schema.json"
        }
    }
}
