{
  "name": "ShInvoke",
  "desc": "ShInvoke.",
  "meta": {
    "uuid": "8334550b-c1fd-44ee-a268-8158deccbf82",
    "relations": {
      "PROVIDED_BY": {
        "direction": "outgoing",
        "to": [
          "7c1c3278-6eb4-4be5-8b8d-94204bfd2223"
        ]
      },
      "APPLIES_TO": {
        "direction": "outgoing",
        "to": [
          "7c1c3278-6eb4-4be5-8b8d-94204bfd2223"
        ]
      },
      "GIVES_CAPABILITY": {
        "direction": "outgoing",
        "to": [
          "4251040d-f05c-4711-8094-59ce773a8c35"
        ]
      },
      "INSTANCE_OF": {
        "direction": "outgoing",
        "to": [
          "f482204e-7d63-45ca-96c9-10a7cc2783da"
        ]
      }
    }
  },
  "data": {
    "instrumentType": "controller",
    "subjectIsLocal": true,
    "arguments": {
      "script": {
        "value": {
          "from": "static",
          "type": "string",
          "strategy": "mustBeOne"
        },
        "canBeUserSupplied": false,
        "isOptional": false
      }
    }
  },
  "file": {
    "dataSchema": {
      "encoding": "text",
      "format": "json",
      "path": "../core/schema/controller.schema.json"
    },
    "templateFile": {
      "encoding": "text",
      "format": "hbs",
      "path": "shinvoke.hbs.sh"
    }
  }
}
