{
  "name": "stop",
  "desc": "OpenRcStop.",
  "meta": {
    "uuid": "b71d662f-700a-4e1b-b65e-4e1418835d8c",
    "relations": {
      "PROVIDED_BY": {
        "direction": "outgoing",
        "uuids": [
          "d6788168-c131-4c9b-8b3c-eae7215e528e"
        ]
      },
      "APPLIES_TO": {
        "direction": "outgoing",
        "uuids": [
          "3fb4603b-281e-47c0-b338-768ea05d4660"
        ]
      },
      "GIVES_CAPABILITY": {
        "direction": "outgoing",
        "uuids": [
          "632ca701-2648-4df5-87ee-a41d3d1ef3da"
        ]
      },
      "INSTANCE_OF": {
        "direction": "outgoing",
        "uuids": [
          "f482204e-7d63-45ca-96c9-10a7cc2783da"
        ]
      }
    }
  },
  "data": {
    "instrumentType": "controller",
    "subjectIsLocal": true,
    "arguments": {
      "origin": {
        "value": {
          "from": "origin",
          "type": "type.component.software.server",
          "strategy": "mustBeOne",
          "onError": "fail"
        },
        "canBeUserSupplied": false,
        "isOptional": false
      }
    }
  },
  "file": {
    "dataSchema": {
      "encoding": "text",
      "format": "json",
      "path": "../core/schema/controller.schema.json"
    },
    "templateFile": {
      "encoding": "text",
      "format": "hbs",
      "path": "openrcstop.hbs.sh"
    }
  }
}
