{
  "name": "BsdrcInitStart",
  "desc": "Start a service with its BSD rc.d script.",
  "meta": {
    "uuid": "9e45d1c7-2a55-412e-a475-db6e5b18cff8",
    "relations": {
      "PROVIDED_BY": {
        "direction": "outgoing",
        "to": ["BsdrcInit"]
      },
      "APPLIES_TO": {
        "direction": "outgoing",
        "to": ["Service"]
      },
      "GIVES_CAPABILITY": {
        "direction": "outgoing",
        "to": ["Start"]
      },
      "INSTANCE_OF": {
        "direction": "outgoing",
        "to": ["Controller"]
      }
    }
  },
  "data": {
    "instrumentType": "controller",
    "subjectIsLocal": true,
    "arguments": {
      "origin": {
        "value": {
          "from": "origin",
          "type": "type.component.software.service",
          "strategy": "mustBeOne",
          "onError": "fail"
        },
        "canBeUserSupplied": false,
        "isOptional": false
      }
    }
  },
  "file": {
    "dataSchema": {
      "encoding": "text",
      "format": "json",
      "path": "../core/schema/controller.schema.json"
    },
    "templateFile": {
      "encoding": "text",
      "format": "hbs",
      "path": "bsdrcinitstart.hbs.sh"
    }
  }
}
