{
  "name": "start",
  "desc": "OpenRcStart.",
  "meta": {
    "uuid": "abee3407-5bcf-45be-92a8-8aec16ab2b7f",
    "relations": {
      "PROVIDED_BY": {
        "direction": "outgoing",
        "to": ["d6788168-c131-4c9b-8b3c-eae7215e528e"]
      },
      "APPLIES_TO": {
        "direction": "outgoing",
        "to": ["3fb4603b-281e-47c0-b338-768ea05d4660"]
      },
      "GIVES_CAPABILITY": {
        "direction": "outgoing",
        "to": ["347ca5da-db19-4d98-9fed-60e72d5d6bba"]
      },
      "INSTANCE_OF": {
        "direction": "outgoing",
        "to": ["f482204e-7d63-45ca-96c9-10a7cc2783da"]
      }
    }
  },
  "data": {
    "instrumentType": "controller",
    "subjectIsLocal": true,
    "arguments": {
      "origin": {
        "value": {
          "from": "origin",
          "type": "type.component.software.server",
          "strategy": "mustBeOne",
          "onError": "fail"
        },
        "canBeUserSupplied": false,
        "isOptional": false
      }
    }
  },
  "file": {
    "dataSchema": {
      "encoding": "text",
      "format": "json",
      "path": "../core/schema/controller.schema.json"
    },
    "templateFile": {
      "encoding": "text",
      "format": "hbs",
      "path": "openrcstart.hbs.sh"
    }
  }
}
