{
  "name": "NmapProfile",
  "desc": "A profile that detects nmap.",
  "meta": {
    "uuid": "4c64d4f7-7e60-4db8-b3c7-d6fc3b0f0221",
    "relations": {
      "INSTANCE_OF": {
        "direction": "outgoing",
        "to": ["Profile"]
      },
      "APPLIES_TO": {
        "direction": "outgoing",
        "to": ["Nmap"]
      },
      "PROVIDED_BY": {
        "direction": "outgoing",
        "to": ["Nmap"]
      }
    }
  },
  "data": {
    "directories": {
      "binaryDirectories": ["/bin", "/usr/bin", "/usr/local/bin"]
    },
    "files": {
      "binaryFiles": ["nmap"]
    }
  }
}
