{
  "name": "BashInvoke",
  "desc": "Run a script with Bash.",
  "meta": {
    "uuid": "8cabd118-dcc2-4bc6-bf0e-11cecfce4a5b",
    "relations": {
      "PROVIDED_BY": {
        "direction": "outgoing",
        "to": ["Bash"]
      },
      "APPLIES_TO": {
        "direction": "outgoing",
        "to": ["Bash"]
      },
      "GIVES_CAPABILITY": {
        "direction": "outgoing",
        "to": ["Invoke"]
      },
      "INSTANCE_OF": {
        "direction": "outgoing",
        "to": ["Controller"]
      }
    }
  },
  "data": {
    "instrumentType": "controller",
    "subjectIsLocal": true,
    "arguments": {
      "script": {
        "value": {
          "from": "static",
          "type": "string",
          "strategy": "mustBeOne"
        },
        "canBeUserSupplied": false,
        "isOptional": false
      }
    }
  },
  "file": {
    "dataSchema": {
      "encoding": "text",
      "format": "json",
      "path": "../core/schema/controller.schema.json"
    },
    "templateFile": {
      "encoding": "text",
      "format": "hbs",
      "path": "bashinvoke.hbs.sh"
    }
  }
}
